{
  "items": [
    {
      "fresh_window_seconds": 45,
      "id": "recovery-details-freshness",
      "last_good_allowed": true,
      "offline_allowed": true,
      "projection": "recovery-details",
      "stale_window_seconds": 300,
      "status": "verified",
      "ui_label": "Saved recovery details"
    },
    {
      "fresh_window_seconds": 60,
      "id": "recovery-history-freshness",
      "last_good_allowed": true,
      "offline_allowed": true,
      "projection": "recovery-backup-history",
      "stale_window_seconds": 900,
      "status": "verified",
      "ui_label": "Saved first page only"
    },
    {
      "fresh_window_seconds": 30,
      "id": "recovery-summary-freshness",
      "last_good_allowed": true,
      "offline_allowed": true,
      "projection": "recovery-summary",
      "stale_window_seconds": 300,
      "status": "verified",
      "ui_label": "Showing saved state"
    }
  ],
  "kind": "freshness-policy",
  "schema_version": "1.0.0",
  "semantic_fingerprint": "44a849b588fbdf72c3f81bf6f44ee5beef37bfd3c290bd1247a85d7ba4f0135c",
  "source_revision": "repository-source",
  "status": "generated"
}
