{
  "items": [
    {
      "id": "component-local",
      "may_store": [
        "ephemeral disclosure state",
        "copied-label feedback"
      ],
      "must_not_store": [
        "backend authority",
        "secrets",
        "durable operation truth"
      ],
      "owner": "component",
      "responsibility": "small component-local presentation state only",
      "status": "verified"
    },
    {
      "id": "dexie",
      "may_store": [
        "allowlisted safe Lite summaries",
        "bounded snapshot metadata"
      ],
      "must_not_store": [
        "write responses",
        "credentials",
        "raw manifests",
        "raw evidence",
        "private paths",
        "identity or invite secrets"
      ],
      "owner": "frontend-offline-snapshot",
      "responsibility": "sanitized read-only fallback snapshots for explicitly eligible Lite GET projections",
      "status": "verified"
    },
    {
      "id": "playwright",
      "may_store": [
        "bounded sanitized semantic observations",
        "failure-only local artifacts"
      ],
      "must_not_store": [
        "backend authority",
        "raw secrets",
        "phone identity",
        "hostnames",
        "usernames",
        "private addresses"
      ],
      "owner": "browser-quality",
      "responsibility": "mocked and explicit live browser semantic observation",
      "status": "verified"
    },
    {
      "id": "storybook-msw",
      "may_store": [
        "synthetic sanitized scenarios"
      ],
      "must_not_store": [
        "production truth",
        "live credentials"
      ],
      "owner": "quality-fixtures",
      "responsibility": "deterministic fixture rendering",
      "status": "verified"
    },
    {
      "id": "tanstack-query",
      "may_store": [
        "sanitized Lite API projections",
        "ETags",
        "query timestamps"
      ],
      "must_not_store": [
        "durable business authority",
        "secrets",
        "raw SQLite rows",
        "write success before FastAPI confirmation"
      ],
      "owner": "frontend-server-state",
      "responsibility": "live FastAPI read cache, focused invalidation, stale/reconnect behavior across Lite tabs",
      "status": "verified"
    },
    {
      "id": "xstate",
      "may_store": [
        "requested/queued/running UI stages",
        "accepted command reference",
        "confirmation state"
      ],
      "must_not_store": [
        "durable operation truth",
        "raw backend payloads",
        "offline write queue"
      ],
      "owner": "frontend-workflow-state",
      "responsibility": "visible guided workflow coordination for risky or multi-step Lite actions",
      "status": "verified"
    },
    {
      "id": "zustand",
      "may_store": [
        "active tab",
        "Manage/details open state",
        "selected UI sections",
        "toast and refresh feedback"
      ],
      "must_not_store": [
        "authoritative backend status",
        "device or app truth",
        "backup or security completion truth",
        "secrets"
      ],
      "owner": "frontend-ui-state",
      "responsibility": "harmless cross-tab overlay, navigation, selection, and feedback state",
      "status": "verified"
    }
  ],
  "kind": "frontend-state-ownership",
  "schema_version": "1.0.0",
  "semantic_fingerprint": "8a90a66c46a250cebfd7e62993f9c541fa1c293fd7e4dd880cc399353b42bff4",
  "source_revision": "repository-source",
  "status": "generated"
}
