{
  "items": [
    {
      "api_projections": [
        "catalog",
        "app-actions"
      ],
      "backend_authorities": [
        "app-current-state",
        "app-action-lifecycle"
      ],
      "fixture_coverage": "verified",
      "frontend_surface": "src/lite/LiteCatalog.jsx",
      "id": "apps",
      "known_gaps": [
        "PhotoPrism is cataloged; full cross-app parity remains planned."
      ],
      "label": "Apps",
      "live_api_coverage": "unvalidated",
      "live_termux_coverage": "runtime-source-verified",
      "mocked_playwright_coverage": "verified",
      "selector": "selectLiteCatalogView",
      "status": "partial",
      "storybook_coverage": "verified",
      "vertical_slice": false
    },
    {
      "api_projections": [
        "fleet"
      ],
      "backend_authorities": [
        "device-current-state",
        "device-heartbeats",
        "device-supervisor-state"
      ],
      "fixture_coverage": "verified",
      "frontend_surface": "src/lite/LiteDevices.jsx",
      "id": "devices",
      "known_gaps": [
        "Parity mappings are source-derived catalog entries only in this increment."
      ],
      "label": "Devices",
      "live_api_coverage": "unvalidated",
      "live_termux_coverage": "runtime-source-verified",
      "mocked_playwright_coverage": "verified",
      "selector": "selectDevicesScreenView",
      "status": "partial",
      "storybook_coverage": "verified",
      "vertical_slice": false
    },
    {
      "api_projections": [
        "recovery-summary",
        "recovery-details",
        "recovery-operations",
        "recovery-backup-history"
      ],
      "backend_authorities": [
        "backup-state-file",
        "backup-manifest",
        "backup-receipt",
        "restore-preview",
        "restore-checkpoint",
        "restore-run",
        "backup-manifest-index",
        "recovery-operations",
        "recovery-current-state",
        "database-backup-table",
        "database-restore-table"
      ],
      "fixture_coverage": "verified",
      "frontend_surface": "src/lite/LiteRecovery.jsx",
      "id": "recovery",
      "known_gaps": [
        "Live Termux parity is opt-in and read-only.",
        "Visual parity is semantic and not pixel equality.",
        "App restore apply remains explicitly unsupported by the repository."
      ],
      "label": "Backup & Restore",
      "live_api_coverage": "verified",
      "live_termux_coverage": "verified",
      "mocked_playwright_coverage": "verified",
      "selector": "selectRecoveryScreenView",
      "status": "verified",
      "storybook_coverage": "verified",
      "vertical_slice": true
    },
    {
      "api_projections": [
        "release-status"
      ],
      "backend_authorities": [
        "installed-release-identity",
        "release-runtime-projection"
      ],
      "fixture_coverage": "verified",
      "frontend_surface": "src/lite/LiteHome.jsx",
      "id": "releases",
      "known_gaps": [
        "Release apply is excluded from parity property and live read-only gates."
      ],
      "label": "Releases",
      "live_api_coverage": "unvalidated",
      "live_termux_coverage": "runtime-source-verified",
      "mocked_playwright_coverage": "partial",
      "selector": "source-derived",
      "status": "partial",
      "storybook_coverage": "partial",
      "vertical_slice": false
    },
    {
      "api_projections": [
        "rules"
      ],
      "backend_authorities": [
        "workflow-current-state"
      ],
      "fixture_coverage": "partial",
      "frontend_surface": "src/lite/LiteRules.jsx",
      "id": "rules",
      "known_gaps": [
        "Repository exposes a partial product contract; authoritative mappings are planned."
      ],
      "label": "Rules",
      "live_api_coverage": "unvalidated",
      "live_termux_coverage": "unvalidated",
      "mocked_playwright_coverage": "partial",
      "selector": "unverified",
      "status": "planned",
      "storybook_coverage": "partial",
      "vertical_slice": false
    },
    {
      "api_projections": [
        "security-summary",
        "security-profile",
        "security-history"
      ],
      "backend_authorities": [
        "security-scan-runs",
        "security-findings",
        "security-compact-state"
      ],
      "fixture_coverage": "verified",
      "frontend_surface": "src/lite/LiteSecurity.jsx",
      "id": "security",
      "known_gaps": [
        "Live scanner parity is not part of ordinary documentation generation."
      ],
      "label": "Security",
      "live_api_coverage": "unvalidated",
      "live_termux_coverage": "runtime-source-verified",
      "mocked_playwright_coverage": "verified",
      "selector": "selectSecurityScreenView",
      "status": "partial",
      "storybook_coverage": "verified",
      "vertical_slice": false
    }
  ],
  "kind": "domain-catalog",
  "schema_version": "1.0.0",
  "semantic_fingerprint": "6416acf0e1764391a0818d34e899f07cdf587e197b13c5481b87128c5caaad57",
  "source_revision": "repository-source",
  "status": "generated"
}
