{
  "items": [
    {
      "backend_observations": {
        "runtime_status": "ready"
      },
      "description": "A bounded fixture deliberately contradicts one critical semantic field.",
      "domain": "apps",
      "expected_runtime_parity": "drift-detected",
      "frontend_observations": {
        "screen_text": "PhotoPrism is stopped"
      },
      "id": "apps-deliberate-drift",
      "kind": "deliberate-drift",
      "mapping_id": "apps-runtime-presentation"
    },
    {
      "backend_observations": {
        "runtime_status": "ready"
      },
      "description": "Backend and UI meaning agree through an allowlisted presentation mapping.",
      "domain": "apps",
      "expected_runtime_parity": "verified-with-mapped-presentation",
      "frontend_observations": {
        "screen_text": "PhotoPrism is running"
      },
      "id": "apps-mapped-presentation",
      "kind": "canonical",
      "mapping_id": "apps-runtime-presentation"
    },
    {
      "backend_observations": {
        "remote_access_ready": false
      },
      "description": "A bounded fixture deliberately contradicts one critical semantic field.",
      "domain": "devices",
      "expected_runtime_parity": "drift-detected",
      "frontend_observations": {
        "screen_text": "Remote access ready"
      },
      "id": "devices-deliberate-drift",
      "kind": "deliberate-drift",
      "mapping_id": "devices-remote-access"
    },
    {
      "backend_observations": {
        "remote_access_ready": false
      },
      "description": "Backend and UI meaning agree through an allowlisted presentation mapping.",
      "domain": "devices",
      "expected_runtime_parity": "verified-with-mapped-presentation",
      "frontend_observations": {
        "screen_text": "Remote access not ready"
      },
      "id": "devices-mapped-presentation",
      "kind": "canonical",
      "mapping_id": "devices-remote-access"
    },
    {
      "backend_observations": {
        "overall_status": "healthy"
      },
      "description": "A bounded fixture deliberately contradicts one critical semantic field.",
      "domain": "home",
      "expected_runtime_parity": "drift-detected",
      "frontend_observations": {
        "screen_text": "System offline"
      },
      "id": "home-deliberate-drift",
      "kind": "deliberate-drift",
      "mapping_id": "home-overall-presentation"
    },
    {
      "backend_observations": {
        "overall_status": "healthy"
      },
      "description": "Backend and UI meaning agree through an allowlisted presentation mapping.",
      "domain": "home",
      "expected_runtime_parity": "verified-with-mapped-presentation",
      "frontend_observations": {
        "screen_text": "Your self hosted workspace is ready"
      },
      "id": "home-mapped-presentation",
      "kind": "canonical",
      "mapping_id": "home-overall-presentation"
    },
    {
      "backend_observations": {
        "status": "ready"
      },
      "description": "A bounded fixture deliberately contradicts one critical semantic field.",
      "domain": "identity",
      "expected_runtime_parity": "drift-detected",
      "frontend_observations": {
        "screen_text": "Identity unavailable"
      },
      "id": "identity-deliberate-drift",
      "kind": "deliberate-drift",
      "mapping_id": "identity-status-presentation"
    },
    {
      "backend_observations": {
        "status": "ready"
      },
      "description": "Backend and UI meaning agree through an allowlisted presentation mapping.",
      "domain": "identity",
      "expected_runtime_parity": "verified-with-mapped-presentation",
      "frontend_observations": {
        "screen_text": "Access readiness is ready"
      },
      "id": "identity-mapped-presentation",
      "kind": "canonical",
      "mapping_id": "identity-status-presentation"
    },
    {
      "backend_observations": {
        "status": "healthy"
      },
      "description": "A bounded fixture deliberately contradicts one critical semantic field.",
      "domain": "recovery",
      "expected_runtime_parity": "drift-detected",
      "frontend_observations": {
        "status_label": "Recovery failed"
      },
      "id": "recovery-deliberate-drift",
      "kind": "deliberate-drift",
      "mapping_id": "recovery-status-presentation"
    },
    {
      "backend_observations": {
        "status": "healthy"
      },
      "description": "Backend and UI meaning agree through an allowlisted presentation mapping.",
      "domain": "recovery",
      "expected_runtime_parity": "verified-with-mapped-presentation",
      "frontend_observations": {
        "status_label": "Protection ready"
      },
      "id": "recovery-mapped-presentation",
      "kind": "canonical",
      "mapping_id": "recovery-status-presentation"
    },
    {
      "backend_observations": {
        "engine_healthy": true
      },
      "description": "A bounded fixture deliberately contradicts one critical semantic field.",
      "domain": "rules",
      "expected_runtime_parity": "drift-detected",
      "frontend_observations": {
        "screen_text": "Protected changes paused. Changes blocked."
      },
      "id": "rules-deliberate-drift",
      "kind": "deliberate-drift",
      "mapping_id": "rules-engine-health-presentation"
    },
    {
      "backend_observations": {
        "engine_healthy": true
      },
      "description": "Backend and UI meaning agree through an allowlisted presentation mapping.",
      "domain": "rules",
      "expected_runtime_parity": "verified-with-mapped-presentation",
      "frontend_observations": {
        "screen_text": "Rules ready. Safety Rules are active for protected changes. Fail-closed ready."
      },
      "id": "rules-mapped-presentation",
      "kind": "canonical",
      "mapping_id": "rules-engine-health-presentation"
    },
    {
      "backend_observations": {
        "status": "healthy"
      },
      "description": "A bounded fixture deliberately contradicts one critical semantic field.",
      "domain": "security",
      "expected_runtime_parity": "drift-detected",
      "frontend_observations": {
        "screen_text": "Critical scanner mismatch"
      },
      "id": "security-deliberate-drift",
      "kind": "deliberate-drift",
      "mapping_id": "security-summary-presentation"
    },
    {
      "backend_observations": {
        "status": "healthy"
      },
      "description": "Backend and UI meaning agree through an allowlisted presentation mapping.",
      "domain": "security",
      "expected_runtime_parity": "verified-with-mapped-presentation",
      "frontend_observations": {
        "screen_text": "No urgent safety issues"
      },
      "id": "security-mapped-presentation",
      "kind": "canonical",
      "mapping_id": "security-summary-presentation"
    }
  ],
  "kind": "runtime-scenario-registry",
  "schema_version": "1.0.0",
  "semantic_fingerprint": "0b555a4643cccbb5d48b5dd4e1492fc4487803cb12ab52681cdbd77e6e2bac27",
  "source_revision": "repository-source",
  "status": "generated"
}
