{
  "items": [
    {
      "api_routes": [
        "/api/lite/catalog",
        "/api/lite/apps/photoprism/actions",
        "/api/lite/apps/lifecycle"
      ],
      "fingerprint": "d9bb9cdc377059b0dd26e3f14869a4a9b56e62b7b64775608b08f8ec2737ff0b",
      "id": "apps",
      "selectors": [
        "selectLiteCatalogAppSummary",
        "selectPhotoPrismActionsView",
        "selectPhotoPrismManageView"
      ],
      "semantic_mapping_ids": [
        "apps-canonical-name",
        "apps-open-capability",
        "apps-installed-manage",
        "apps-runtime-presentation",
        "apps-sanitized-ui"
      ]
    }
  ],
  "kind": "domain-fingerprint",
  "schema_version": "1.0.0",
  "semantic_fingerprint": "44a849b588fbdf72c3f81bf6f44ee5beef37bfd3c290bd1247a85d7ba4f0135c",
  "source_revision": "repository-source",
  "status": "generated"
}
