{
  "items": [
    {
      "api_routes": [
        "/api/lite/recovery/backups",
        "/api/lite/recovery/database",
        "/api/lite/recovery/details",
        "/api/lite/recovery/operations",
        "/api/lite/recovery/summary"
      ],
      "fingerprint": "b0c467376c96afa7dc176729357b52de68dcb9767b741027e939d0b4b2131aad",
      "id": "recovery",
      "selectors": [
        "selectRecoverySummaryView",
        "selectRecoveryScreenView"
      ],
      "semantic_mapping_ids": [
        "recovery-latest-backup-identity",
        "recovery-stale-semantics",
        "recovery-write-safety",
        "recovery-status-presentation",
        "recovery-summary-presentation",
        "recovery-sanitized-ui",
        "recovery-last-restore-identity",
        "recovery-last-restore-status",
        "recovery-history-count",
        "recovery-historical-preview-safety"
      ]
    }
  ],
  "kind": "domain-fingerprint",
  "schema_version": "1.0.0",
  "semantic_fingerprint": "0b555a4643cccbb5d48b5dd4e1492fc4487803cb12ab52681cdbd77e6e2bac27",
  "source_revision": "repository-source",
  "status": "generated"
}
