{
  "items": [
    {
      "api_routes": [
        "/api/lite/status",
        "/api/lite/release"
      ],
      "fingerprint": "42f03890dc41e562409358ab0ae54f5e980a4cf57d06ac7d5a496d214b3ffcf6",
      "id": "home",
      "selectors": [
        "buildLiteHomeOverview"
      ],
      "semantic_mapping_ids": [
        "home-overall-presentation",
        "home-server-identity",
        "home-cpu-format",
        "home-sanitized-ui"
      ]
    }
  ],
  "kind": "domain-fingerprint",
  "schema_version": "1.0.0",
  "semantic_fingerprint": "44a849b588fbdf72c3f81bf6f44ee5beef37bfd3c290bd1247a85d7ba4f0135c",
  "source_revision": "repository-source",
  "status": "generated"
}
