{
  "items": [
    {
      "api_routes": [
        "/api/lite/identity"
      ],
      "fingerprint": "683ad844e9b488ebec6c7d491f411bf94fbbc1c4ab702fdaeadeebac8170423f",
      "id": "identity",
      "selectors": [
        "direct-render"
      ],
      "semantic_mapping_ids": [
        "identity-status-presentation",
        "identity-summary",
        "identity-password-redaction"
      ]
    }
  ],
  "kind": "domain-fingerprint",
  "schema_version": "1.0.0",
  "semantic_fingerprint": "44a849b588fbdf72c3f81bf6f44ee5beef37bfd3c290bd1247a85d7ba4f0135c",
  "source_revision": "repository-source",
  "status": "generated"
}
