{
  "items": [
    {
      "api_routes": [
        "/api/lite/policy"
      ],
      "fingerprint": "c377622715d19fa0741384eb7d92cac13f862496f4dd6683df13a5b4042d3439",
      "id": "rules",
      "selectors": [
        "direct-render"
      ],
      "semantic_mapping_ids": [
        "rules-protection-state",
        "rules-protection-presentation",
        "rules-summary",
        "rules-sanitized-ui"
      ]
    }
  ],
  "kind": "domain-fingerprint",
  "schema_version": "1.0.0",
  "semantic_fingerprint": "44a849b588fbdf72c3f81bf6f44ee5beef37bfd3c290bd1247a85d7ba4f0135c",
  "source_revision": "repository-source",
  "status": "generated"
}
