{
  "items": [
    {
      "api_routes": [
        "/api/lite/security/summary",
        "/api/lite/security/profiles/quick",
        "/api/lite/security/history?limit=20"
      ],
      "fingerprint": "f18ace83707548733330d4d99a8bbe465e6e79251e6139248a02629e49af3c31",
      "id": "security",
      "selectors": [
        "selectSecuritySummaryView",
        "selectSecurityScreenView",
        "selectSecurityProfileView"
      ],
      "semantic_mapping_ids": [
        "security-summary-presentation",
        "security-primary-action",
        "security-profile-presentation",
        "security-sanitized-ui"
      ]
    }
  ],
  "kind": "domain-fingerprint",
  "schema_version": "1.0.0",
  "semantic_fingerprint": "0b555a4643cccbb5d48b5dd4e1492fc4487803cb12ab52681cdbd77e6e2bac27",
  "source_revision": "repository-source",
  "status": "generated"
}
